{
  "schema": "ResidualOps_ExternalShareRefreshManifest/v0.1",
  "generated_at": "2026-05-30T04:49:20.141104+00:00",
  "artifact_count": 19,
  "artifacts": [
    {
      "path": "external_share_pack_v2/README_EXTERNAL_SAFE_DEMO_V2.md",
      "size": 1007,
      "sha256": "c136d7d7aebe01856582d6b8c4c3b49f800719360fb45926f257dd9b5d494f3f",
      "source_path": "",
      "artifact_type": "external_safe_readme_v2",
      "safe_to_share_publicly": true,
      "reason": "redacted static local V2 demo artifact with visible claim ceiling and skipped/HOLD status preserved"
    },
    {
      "path": "external_share_pack_v2/RESIDUALOPS_EXTERNAL_SAFE_DEMO_V2.html",
      "size": 2660,
      "sha256": "3ab95ff08236ba9a2e835720876b8638f121ece8e95e9a765f96e31e34a39fa7",
      "source_path": "",
      "artifact_type": "static_html_demo_v2",
      "safe_to_share_publicly": true,
      "reason": "redacted static local V2 demo artifact with visible claim ceiling and skipped/HOLD status preserved"
    },
    {
      "path": "external_share_pack_v2/RESIDUALOPS_EXTERNAL_SAFE_DEMO_V2.md",
      "size": 1376,
      "sha256": "2e8f00bc25aa196074d802a528408458d5abab631ea205f72c9f3e571ac1d95a",
      "source_path": "",
      "artifact_type": "external_safe_artifact_v2",
      "safe_to_share_publicly": true,
      "reason": "redacted static local V2 demo artifact with visible claim ceiling and skipped/HOLD status preserved"
    },
    {
      "path": "external_share_pack_v2/RESIDUALOPS_EXTERNAL_SAFE_DASHBOARD_V2.json",
      "size": 19721,
      "sha256": "51d8c742fe4e6a8d6d8f7999831f7957062393aab673caadeb76e8e714e13ec7",
      "source_path": "pilot_dashboard/ROE21_DASHBOARD_REFRESH_DELTA.json",
      "artifact_type": "redacted_dashboard_v2",
      "safe_to_share_publicly": true,
      "reason": "redacted static local V2 demo artifact with visible claim ceiling and skipped/HOLD status preserved"
    },
    {
      "path": "external_share_pack_v2/RESIDUALOPS_EXTERNAL_SAFE_STATUS_CARDS_V2.json",
      "size": 3547,
      "sha256": "33fb186dd39d17aa8347aa07ba8fb1c725844df588a58540396efb331b2397a6",
      "source_path": "pilot_dashboard/ROE21_FEEDBACK_SECOND_RUN_STATUS_CARDS.json",
      "artifact_type": "status_cards_v2",
      "safe_to_share_publicly": true,
      "reason": "redacted static local V2 demo artifact with visible claim ceiling and skipped/HOLD status preserved"
    },
    {
      "path": "external_share_pack_v2/RESIDUALOPS_EXTERNAL_SAFE_TIMELINE_V2.json",
      "size": 1890,
      "sha256": "13811411ab030cc253206d32803097e262e713e612c2ce52d268e526dc60019b",
      "source_path": "pilot_dashboard/ROE21_FEEDBACK_SECOND_RUN_TIMELINE.json",
      "artifact_type": "timeline_v2",
      "safe_to_share_publicly": true,
      "reason": "redacted static local V2 demo artifact with visible claim ceiling and skipped/HOLD status preserved"
    },
    {
      "path": "external_share_pack_v2/RESIDUALOPS_EXTERNAL_SAFE_FEEDBACK_MEMORY_V2.json",
      "size": 2021,
      "sha256": "30e756d82ad9509f138b42db9c727cf774ac37846f0eaaa6eb410ae3fd8deef4",
      "source_path": "pilot_dashboard/ROE21_FEEDBACK_SECOND_RUN_MEMORY_SUMMARY.json",
      "artifact_type": "feedback_memory_v2",
      "safe_to_share_publicly": true,
      "reason": "redacted static local V2 demo artifact with visible claim ceiling and skipped/HOLD status preserved"
    },
    {
      "path": "external_share_pack_v2/RESIDUALOPS_EXTERNAL_SAFE_CLAIM_BOUNDARY_V2.md",
      "size": 451,
      "sha256": "44bbc2224fee2518f24dbd371ea243b66beb2b36308ba880abd5f17f0015b696",
      "source_path": "",
      "artifact_type": "claim_boundary_or_audit_v2",
      "safe_to_share_publicly": true,
      "reason": "redacted static local V2 demo artifact with visible claim ceiling and skipped/HOLD status preserved"
    },
    {
      "path": "external_share_pack_v2/RESIDUALOPS_EXTERNAL_SAFE_KNOWN_LIMITS_V2.md",
      "size": 790,
      "sha256": "0af3218317b1d500182c21815cd3fc7f6e88566aab44034ae97bffbcc5ff6571",
      "source_path": "",
      "artifact_type": "external_safe_artifact_v2",
      "safe_to_share_publicly": true,
      "reason": "redacted static local V2 demo artifact with visible claim ceiling and skipped/HOLD status preserved"
    },
    {
      "path": "external_share_pack_v2/RESIDUALOPS_EXTERNAL_SAFE_OPERATOR_SCRIPT_V2.md",
      "size": 798,
      "sha256": "a44c243818be544d283da5786b2255f0d048892e7d290b9a7bdd44836172d559",
      "source_path": "",
      "artifact_type": "operator_script_v2",
      "safe_to_share_publicly": true,
      "reason": "redacted static local V2 demo artifact with visible claim ceiling and skipped/HOLD status preserved"
    },
    {
      "path": "external_share_pack_v2/RESIDUALOPS_EXTERNAL_SAFE_SCREENSHOT_SCRIPT_V2.md",
      "size": 549,
      "sha256": "5af3e29d743cffbef489cf657641849c4f761b3643570d7254d9759964a95347",
      "source_path": "",
      "artifact_type": "operator_script_v2",
      "safe_to_share_publicly": true,
      "reason": "redacted static local V2 demo artifact with visible claim ceiling and skipped/HOLD status preserved"
    },
    {
      "path": "external_share_pack_v2/RESIDUALOPS_EXTERNAL_SAFE_VIDEO_SCRIPT_V2.md",
      "size": 828,
      "sha256": "b83fe6fdace03768d2891b30f1d5886dc5b556849f3398ad30bc55e95830da4a",
      "source_path": "",
      "artifact_type": "operator_script_v2",
      "safe_to_share_publicly": true,
      "reason": "redacted static local V2 demo artifact with visible claim ceiling and skipped/HOLD status preserved"
    },
    {
      "path": "external_share_pack_v2/RESIDUALOPS_EXTERNAL_SAFE_REFRESH_DELTA_V2.json",
      "size": 2983,
      "sha256": "8bc2af0aa33fd3101730b3a3b327d2e6cca99bb252d8e3bf22ce9ac596494b4a",
      "source_path": "pilot_dashboard/ROE21_DASHBOARD_REFRESH_DELTA.json",
      "artifact_type": "refresh_delta_v2",
      "safe_to_share_publicly": true,
      "reason": "redacted static local V2 demo artifact with visible claim ceiling and skipped/HOLD status preserved"
    },
    {
      "path": "external_share_pack_v2/RESIDUALOPS_EXTERNAL_SAFE_SHARE_DECISION_V2.md",
      "size": 743,
      "sha256": "41eca540a9d19bcf1749b0d8149bdca32269859df544bbf638d98c95ae267db6",
      "source_path": "",
      "artifact_type": "external_safe_artifact_v2",
      "safe_to_share_publicly": true,
      "reason": "redacted static local V2 demo artifact with visible claim ceiling and skipped/HOLD status preserved"
    },
    {
      "path": "external_share_pack_v2/RESIDUALOPS_EXTERNAL_SAFE_MANIFEST_V2.json",
      "size": 8869,
      "sha256": "64fb8d13c66bfdd6b8d8cec092a69a2976aa70a55b7315b1db5a4e287c2b96ba",
      "source_path": "",
      "artifact_type": "manifest_v2",
      "safe_to_share_publicly": true,
      "reason": "redacted static local V2 demo artifact with visible claim ceiling and skipped/HOLD status preserved"
    },
    {
      "path": "external_share_pack_v2/RESIDUALOPS_EXTERNAL_SAFE_CHECKSUMS_V2.json",
      "size": 2914,
      "sha256": "489e49a6d5793b0f3de7b17ee91ea8906d703fd286cd2ee72d2e699bb8a1debb",
      "source_path": "",
      "artifact_type": "checksums_v2",
      "safe_to_share_publicly": true,
      "reason": "redacted static local V2 demo artifact with visible claim ceiling and skipped/HOLD status preserved"
    },
    {
      "path": "external_share_pack_v2/RESIDUALOPS_EXTERNAL_SAFE_REDACTION_REPORT_V2.json",
      "size": 363,
      "sha256": "db0690ac7b78f6455521205dcf4a75585e194d3fa63a155bc8c14f3a3251a0b5",
      "source_path": "",
      "artifact_type": "redaction_report_v2",
      "safe_to_share_publicly": true,
      "reason": "redacted static local V2 demo artifact with visible claim ceiling and skipped/HOLD status preserved"
    },
    {
      "path": "external_share_pack_v2/RESIDUALOPS_EXTERNAL_SAFE_CLAIM_AUDIT_V2.json",
      "size": 434,
      "sha256": "bff850daf19d64a0d8b8ff6bf1f1f8f62126ee429df22c8b30663d63c91d3d50",
      "source_path": "",
      "artifact_type": "claim_boundary_or_audit_v2",
      "safe_to_share_publicly": true,
      "reason": "redacted static local V2 demo artifact with visible claim ceiling and skipped/HOLD status preserved"
    },
    {
      "path": "external_share_pack_v2/RESIDUALOPS_EXTERNAL_SAFE_DISTRIBUTION_BOUNDARY_V2.json",
      "size": 2043,
      "sha256": "899ae261663d6ad54550184c3a46f42bdd1d5144ce75a3dddd094a843b449bcb",
      "source_path": "",
      "artifact_type": "distribution_boundary_v2",
      "safe_to_share_publicly": true,
      "reason": "redacted static local V2 demo artifact with visible claim ceiling and skipped/HOLD status preserved"
    }
  ],
  "external_actions_performed": false,
  "network_used": false,
  "token_printed": false
}
